{"schema_version":"cognitive-runtime.generation-manifest/v3","contract_version":"v2","builder_format_version":"generation-builder/v3","package_version":"0.3.0","source_revision":"aaaaaaaaaaaaaaaaaaaaaaaaaaaaaaaaaaaaaaaa","authority":{"revision":"aaaaaaaaaaaaaaaaaaaaaaaaaaaaaaaaaaaaaaaa","checksum":"sha256:0000000000000000000000000000000000000000000000000000000000000000"},"domains":[{"domain_id":"fitness","status":"active","projection_revision":"projection-1111111111111111111111111111111111111111111111111111111111111111","pointer_revision":"pointer-2222222222222222222222222222222222222222222222222222222222222222","manifest_checksum":"sha256:3333333333333333333333333333333333333333333333333333333333333333","source_revision":"fitness-1","as_of":"2026-08-24T00:00:00Z"}],"sync_generation":"generation-aaaaaaaaaaaaaaaaaaaaaaaaaaaaaaaaaaaaaaaaaaaaaaaaaaaaaaaaaaaaaaaa","files":[{"path":"registry.json","checksum":"sha256:4444444444444444444444444444444444444444444444444444444444444444","dependencies":[]}]}
